{
  "$schema": "https://json-schema.org/draft/2020-12/schema",
  "$id": "https://deweb.world/schemas/malt/artifact/v0alpha2/artifact.schema.json",
  "title": "MALT Proof Artifact",
  "type": "object",
  "additionalProperties": false,
  "required": ["profile", "operation", "root", "query", "target", "prooflist"],
  "properties": {
    "profile": {"const": "malt.artifact/v0alpha2"},
    "operation": {"enum": ["resolve", "resolve_payload", "prove"]},
    "root": {"type": "string", "minLength": 1},
    "query": {"$ref": "#/$defs/query"},
    "target": {"type": "string", "minLength": 1},
    "range_segments": {
      "type": "array",
      "items": {"type": "string", "minLength": 1}
    },
    "prooflist": {"$ref": "#/$defs/prooflist"}
  },
  "$defs": {
    "cid_link": {
      "type": "object",
      "additionalProperties": false,
      "required": ["/"],
      "properties": {"/": {"type": "string", "minLength": 1}}
    },
    "segments": {
      "type": "array",
      "items": {"type": "string", "minLength": 1, "pattern": "^[^/]+$"}
    },
    "query": {
      "oneOf": [
        {
          "type": "object",
          "additionalProperties": false,
          "required": ["kind"],
          "properties": {
            "kind": {"const": "path"},
            "segments": {
              "$ref": "#/$defs/segments",
              "default": []
            }
          }
        },
        {
          "type": "object",
          "additionalProperties": false,
          "required": ["kind", "segments"],
          "properties": {
            "kind": {"const": "map_key"},
            "segments": {"$ref": "#/$defs/segments", "minItems": 1}
          }
        },
        {
          "type": "object",
          "additionalProperties": false,
          "required": ["kind", "index"],
          "properties": {
            "kind": {"const": "list_index"},
            "index": {"type": "integer", "minimum": 0}
          }
        },
        {
          "type": "object",
          "additionalProperties": false,
          "required": ["kind", "start"],
          "properties": {
            "kind": {"const": "list_range"},
            "start": {"type": "integer", "minimum": 0},
            "end": {"type": "integer", "minimum": 1}
          }
        }
      ]
    },
    "prooflist": {
      "type": "object",
      "additionalProperties": false,
      "required": ["root", "steps"],
      "properties": {
        "root": {"$ref": "#/$defs/cid_link"},
        "query": {"type": "string"},
        "steps": {
          "type": "array",
          "items": {"$ref": "#/$defs/proof_step"}
        }
      }
    },
    "proof_step": {
      "type": "object",
      "additionalProperties": false,
      "required": ["kind", "from", "target"],
      "properties": {
        "kind": {
          "enum": ["map_step", "payload_binding", "list_index", "list_range", "blob_binding", "implicit_block", "legacy_unknown"]
        },
        "from": {"$ref": "#/$defs/cid_link"},
        "query": {"type": "string"},
        "coordinate": {"type": "string"},
        "path": {"type": "string"},
        "index": {"type": "integer", "minimum": 0},
        "length": {"type": "integer", "minimum": 0},
        "start": {"type": "integer", "minimum": 0},
        "end": {"type": "integer", "minimum": 0},
        "child_count": {"type": "integer", "minimum": 0},
        "total_size": {"type": "integer", "minimum": 0},
        "chunk_size": {"type": "integer", "minimum": 0},
        "target": {"$ref": "#/$defs/cid_link"},
        "segments": {"type": "array", "items": {"$ref": "#/$defs/cid_link"}},
        "evidence_kind": {"type": "string"},
        "evidence_backend": {"type": "string"},
        "evidence": {"type": "string", "contentEncoding": "base64"},
        "proof": {"type": "string", "contentEncoding": "base64"}
      }
    }
  }
}
