{
  "profile": "malt.artifact/v0alpha2",
  "operation": "resolve",
  "root": "bafkreihdwdcefgh4dqkjv67uzcmw7ojee6xedzdetojuzjevtenxquvyku",
  "query": {"kind": "path"},
  "target": "bafkreihdwdcefgh4dqkjv67uzcmw7ojee6xedzdetojuzjevtenxquvyku",
  "prooflist": {
    "root": {"/": "bafkreihdwdcefgh4dqkjv67uzcmw7ojee6xedzdetojuzjevtenxquvyku"},
    "steps": []
  }
}
